11:30:08.102024 IP (tos 0x0, ttl 4, id 0, offset 0, flags [DF], proto UDP (17), length 378)
    192.168.1.1.58130 > 239.255.255.250.1900: [udp sum ok] UDP, length 350
11:30:08.103073 IP (tos 0x0, ttl 4, id 0, offset 0, flags [DF], proto UDP (17), length 323)
    192.168.1.1.58130 > 239.255.255.250.1900: [udp sum ok] UDP, length 295
11:30:08.104383 IP (tos 0x0, ttl 4, id 0, offset 0, flags [DF], proto UDP (17), length 314)
    192.168.1.1.58130 > 239.255.255.250.1900: [udp sum ok] UDP, length 286
11:30:08.105346 IP (tos 0x0, ttl 4, id 0, offset 0, flags [DF], proto UDP (17), length 380)
    192.168.1.1.58130 > 239.255.255.250.1900: [udp sum ok] UDP, length 352
11:30:08.106360 IP (tos 0x0, ttl 4, id 0, offset 0, flags [DF], proto UDP (17), length 366)
    192.168.1.1.58130 > 239.255.255.250.1900: [udp sum ok] UDP, length 338
11:30:09.216065 ARP, Ethernet (len 6), IPv4 (len 4), Request who-has 192.168.1.232 tell 192.168.1.1, length 46
11:30:10.257162 ARP, Ethernet (len 6), IPv4 (len 4), Request who-has 192.168.1.232 tell 192.168.1.1, length 46
11:30:10.724417 IP (tos 0x0, ttl 64, id 9824, offset 0, flags [DF], proto UDP (17), length 65)
    192.168.1.104.45249 > 192.168.1.1.53: [bad udp cksum 0x83f8 -> 0x88cd!] 52307+ A? accounts.google.com. (37)
11:30:10.730227 IP (tos 0x0, ttl 64, id 0, offset 0, flags [DF], proto UDP (17), length 81)
    192.168.1.1.53 > 192.168.1.104.45249: [udp sum ok] 52307 q: A? accounts.google.com. 1/0/0 accounts.google.com. A 172.217.20.45 (53)
11:30:12.287152 ARP, Ethernet (len 6), IPv4 (len 4), Request who-has 192.168.1.70 tell 192.168.1.1, length 46
11:30:12.536809 ARP, Ethernet (len 6), IPv4 (len 4), Request who-has 192.168.1.1 tell 192.168.1.80, length 46
11:30:14.053943 IP (tos 0x0, ttl 4, id 0, offset 0, flags [DF], proto UDP (17), length 314)
    192.168.1.1.58130 > 239.255.255.250.1900: [udp sum ok] UDP, length 286
11:30:15.180431 IP (tos 0x0, ttl 4, id 0, offset 0, flags [DF], proto UDP (17), length 380)
    192.168.1.1.58130 > 239.255.255.250.1900: [udp sum ok] UDP, length 352
11:30:15.181288 IP (tos 0x0, ttl 4, id 0, offset 0, flags [DF], proto UDP (17), length 378)
    192.168.1.1.58130 > 239.255.255.250.1900: [udp sum ok] UDP, length 350
11:30:15.182274 IP (tos 0x0, ttl 4, id 0, offset 0, flags [DF], proto UDP (17), length 366)
    192.168.1.1.58130 > 239.255.255.250.1900: [udp sum ok] UDP, length 338
11:30:15.183422 IP (tos 0x0, ttl 4, id 0, offset 0, flags [DF], proto UDP (17), length 323)
    192.168.1.1.58130 > 239.255.255.250.1900: [udp sum ok] UDP, length 295
11:30:15.552295 ARP, Ethernet (len 6), IPv4 (len 4), Request who-has 192.168.1.80 tell 192.168.1.1, length 46
11:30:17.254423 IP (tos 0x0, ttl 64, id 36178, offset 0, flags [DF], proto TCP (6), length 1500)
    192.168.1.1.80 > 192.168.1.104.53300: Flags [.], cksum 0x4cf3 (correct), seq 3832477054:3832478502, ack 2881124067, win 543, options [nop,nop,TS val 50001 ecr 1564063425], length 1448: HTTP, length: 1448
	HTTP/1.1 200 OK
	Server: nginx
	Date: Mon, 13 Jan 2020 10:28:42 GMT
	Content-Type: text/html
	Transfer-Encoding: chunked
	Connection: keep-alive
	Set-Cookie: sessionID=253c8476d6fd6812f4a269235504b895fe4a93a2bd39ceebd6f37ab224f37b69; Path=/; HttpOnly
	cache-control: no-cache
	Content-Language: en-us
	X-Frame-Options: SAMEORIGIN
	Content-Security-Policy: default-src 'self';script-src 'self' 'unsafe-eval' 'unsafe-inline';style-src 'self' 'unsafe-inline'
	
	11
	
	<!DOCTYPE HTML>
	
	13
	<html lang="en-us">
	92
	
	<head>
	    <meta name="viewport" content="width=device-width, initial-scale=1.0">
	    <meta charset="UTF-8">
	    <meta name="CSRFtoken" content="
	40
	253da6330e54ec3455382745fa8e5152b9cd115c482b1de390bdca79026a74f2
	170
	">
	    <link href="/css/gw.css" rel="stylesheet">
	    <link href="/css/responsive.css" rel="stylesheet">
	    <!--[if IE 7]><link rel="stylesheet" href="/css/font-awesome-ie7.css"><![endif]-->
	    <script src="/js/main-min.js" ></script>
	    <!--[if lt IE 9]> <script src="/js/media-min.js"></script> <![endif]-->
	    <script src="/js/srp-min.js" ></script>
	    <title>
	5
	Login
	5d
	</title>
	</head>
	<body>
	  <div class="container">
	    <div class="logo-technicolor"><a href="
	1b
	http:&#47;&#47;www.telia.se
	da
	" target="_blank"><img src="/img/logo.gif"></a></div>
	    <div class="row">
	      <div class="offset4 span4">
	        <div class="login">
	        <form class="form-horizontal">
	          <fieldset>
11:30:17.254470 IP (tos 0x0, ttl 64, id 52263, offset 0, flags [DF], proto TCP (6), length 52)
    192.168.1.104.53300 > 192.168.1.1.80: Flags [.], cksum 0x83e0 (incorrect -> 0xfcdf), seq 1, ack 1448, win 251, options [nop,nop,TS val 1564082660 ecr 50001], length 0
11:30:17.254509 IP (tos 0x0, ttl 64, id 36179, offset 0, flags [DF], proto TCP (6), length 74)
    192.168.1.1.80 > 192.168.1.104.53300: Flags [P.], cksum 0xca0f (correct), seq 1448:1470, ack 1, win 543, options [nop,nop,TS val 50001 ecr 1564063425], length 22: HTTP
11:30:17.254515 IP (tos 0x0, ttl 64, id 52264, offset 0, flags [DF], proto TCP (6), length 52)
    192.168.1.104.53300 > 192.168.1.1.80: Flags [.], cksum 0x83e0 (incorrect -> 0xfcc9), seq 1, ack 1470, win 251, options [nop,nop,TS val 1564082660 ecr 50001], length 0
11:30:17.263412 IP (tos 0x0, ttl 64, id 36180, offset 0, flags [DF], proto TCP (6), length 1500)
    192.168.1.1.80 > 192.168.1.104.53300: Flags [.], cksum 0x97af (correct), seq 1470:2918, ack 1, win 543, options [nop,nop,TS val 50010 ecr 1564082660], length 1448: HTTP
11:30:17.263435 IP (tos 0x0, ttl 64, id 52265, offset 0, flags [DF], proto TCP (6), length 52)
    192.168.1.104.53300 > 192.168.1.1.80: Flags [.], cksum 0x83e0 (incorrect -> 0xf6f8), seq 1, ack 2918, win 274, options [nop,nop,TS val 1564082669 ecr 50010], length 0
11:30:17.263586 IP (tos 0x0, ttl 64, id 36181, offset 0, flags [DF], proto TCP (6), length 188)
    192.168.1.1.80 > 192.168.1.104.53300: Flags [.], cksum 0x2f1b (correct), seq 2918:3054, ack 1, win 543, options [nop,nop,TS val 50010 ecr 1564082660], length 136: HTTP
11:30:17.263594 IP (tos 0x0, ttl 64, id 52266, offset 0, flags [DF], proto TCP (6), length 52)
    192.168.1.104.53300 > 192.168.1.1.80: Flags [.], cksum 0x83e0 (incorrect -> 0xf65a), seq 1, ack 3054, win 296, options [nop,nop,TS val 1564082669 ecr 50010], length 0
11:30:17.263598 IP (tos 0x0, ttl 64, id 36182, offset 0, flags [DF], proto TCP (6), length 194)
    192.168.1.1.80 > 192.168.1.104.53300: Flags [.], cksum 0x20bd (correct), seq 3054:3196, ack 1, win 543, options [nop,nop,TS val 50010 ecr 1564082660], length 142: HTTP
11:30:17.263602 IP (tos 0x0, ttl 64, id 52267, offset 0, flags [DF], proto TCP (6), length 52)
    192.168.1.104.53300 > 192.168.1.1.80: Flags [.], cksum 0x83e0 (incorrect -> 0xf5b5), seq 1, ack 3196, win 319, options [nop,nop,TS val 1564082669 ecr 50010], length 0
11:30:17.266325 IP (tos 0x0, ttl 64, id 17905, offset 0, flags [DF], proto TCP (6), length 52)
    192.168.1.104.53302 > 192.168.1.1.80: Flags [F.], cksum 0x83e0 (incorrect -> 0x1511), seq 8125672, ack 3836695320, win 229, options [nop,nop,TS val 1564082672 ecr 30767], length 0
11:30:17.266377 IP (tos 0x0, ttl 64, id 47764, offset 0, flags [DF], proto TCP (6), length 60)
    192.168.1.104.53304 > 192.168.1.1.80: Flags [S], cksum 0x83e8 (incorrect -> 0x6d06), seq 4140809900, win 29200, options [mss 1460,sackOK,TS val 1564082672 ecr 0,nop,wscale 7], length 0
11:30:17.266571 IP (tos 0x0, ttl 64, id 14444, offset 0, flags [DF], proto TCP (6), length 60)
    192.168.1.104.53306 > 192.168.1.1.80: Flags [S], cksum 0x83e8 (incorrect -> 0x76b6), seq 1870019668, win 29200, options [mss 1460,sackOK,TS val 1564082672 ecr 0,nop,wscale 7], length 0
11:30:17.267220 IP (tos 0x0, ttl 64, id 0, offset 0, flags [DF], proto TCP (6), length 60)
    192.168.1.1.80 > 192.168.1.104.53304: Flags [S.], cksum 0xe42b (correct), seq 4127852770, ack 4140809901, win 14480, options [mss 1460,sackOK,TS val 50014 ecr 1564082672,nop,wscale 5], length 0
11:30:17.267240 IP (tos 0x0, ttl 64, id 47765, offset 0, flags [DF], proto TCP (6), length 52)
    192.168.1.104.53304 > 192.168.1.1.80: Flags [.], cksum 0x83e0 (incorrect -> 0x4aa0), seq 1, ack 1, win 229, options [nop,nop,TS val 1564082673 ecr 50014], length 0
11:30:17.267306 IP (tos 0x0, ttl 64, id 47766, offset 0, flags [DF], proto TCP (6), length 458)
    192.168.1.104.53304 > 192.168.1.1.80: Flags [P.], cksum 0x8576 (incorrect -> 0x1622), seq 1:407, ack 1, win 229, options [nop,nop,TS val 1564082673 ecr 50014], length 406: HTTP, length: 406
	GET /css/gw.css HTTP/1.1
	Host: 192.168.1.1
	Connection: keep-alive
	User-Agent: Mozilla/5.0 (X11; Linux x86_64) AppleWebKit/537.36 (KHTML, like Gecko) Chrome/78.0.3904.108 Safari/537.36
	Accept: text/css,*/*;q=0.1
	Referer: http://192.168.1.1/
	Accept-Encoding: gzip, deflate
	Accept-Language: en-US,en;q=0.9,sv;q=0.8
	Cookie: sessionID=253c8476d6fd6812f4a269235504b895fe4a93a2bd39ceebd6f37ab224f37b69
	
11:30:17.267560 IP (tos 0x0, ttl 64, id 0, offset 0, flags [DF], proto TCP (6), length 60)
    192.168.1.1.80 > 192.168.1.104.53306: Flags [S.], cksum 0xff0d (correct), seq 3420529113, ack 1870019669, win 14480, options [mss 1460,sackOK,TS val 50014 ecr 1564082672,nop,wscale 5], length 0
11:30:17.267566 IP (tos 0x0, ttl 64, id 14445, offset 0, flags [DF], proto TCP (6), length 52)
    192.168.1.104.53306 > 192.168.1.1.80: Flags [.], cksum 0x83e0 (incorrect -> 0x6582), seq 1, ack 1, win 229, options [nop,nop,TS val 1564082673 ecr 50014], length 0
11:30:17.267604 IP (tos 0x0, ttl 64, id 14446, offset 0, flags [DF], proto TCP (6), length 466)
    192.168.1.104.53306 > 192.168.1.1.80: Flags [P.], cksum 0x857e (incorrect -> 0x9524), seq 1:415, ack 1, win 229, options [nop,nop,TS val 1564082673 ecr 50014], length 414: HTTP, length: 414
	GET /css/responsive.css HTTP/1.1
	Host: 192.168.1.1
	Connection: keep-alive
	User-Agent: Mozilla/5.0 (X11; Linux x86_64) AppleWebKit/537.36 (KHTML, like Gecko) Chrome/78.0.3904.108 Safari/537.36
	Accept: text/css,*/*;q=0.1
	Referer: http://192.168.1.1/
	Accept-Encoding: gzip, deflate
	Accept-Language: en-US,en;q=0.9,sv;q=0.8
	Cookie: sessionID=253c8476d6fd6812f4a269235504b895fe4a93a2bd39ceebd6f37ab224f37b69
	
11:30:17.268045 IP (tos 0x0, ttl 64, id 52156, offset 0, flags [DF], proto TCP (6), length 52)
    192.168.1.1.80 > 192.168.1.104.53304: Flags [.], cksum 0x47cf (correct), seq 1, ack 407, win 543, options [nop,nop,TS val 50015 ecr 1564082673], length 0
11:30:17.268443 IP (tos 0x0, ttl 64, id 57989, offset 0, flags [DF], proto TCP (6), length 52)
    192.168.1.1.80 > 192.168.1.104.53306: Flags [.], cksum 0x62a9 (correct), seq 1, ack 415, win 543, options [nop,nop,TS val 50015 ecr 1564082673], length 0
11:30:17.268547 IP (tos 0x0, ttl 64, id 11048, offset 0, flags [DF], proto TCP (6), length 52)
    192.168.1.1.80 > 192.168.1.104.53302: Flags [.], cksum 0xc900 (correct), seq 1, ack 1, win 453, options [nop,nop,TS val 50015 ecr 1564082672], length 0
11:30:17.272534 IP (tos 0x0, ttl 64, id 36182, offset 0, flags [DF], proto TCP (6), length 1500)
    192.168.1.1.80 > 192.168.1.104.53300: Flags [.], cksum 0x8717 (correct), seq 3196:4644, ack 1, win 543, options [nop,nop,TS val 50019 ecr 1564082669], length 1448: HTTP
11:30:17.272569 IP (tos 0x0, ttl 64, id 52268, offset 0, flags [DF], proto TCP (6), length 52)
    192.168.1.104.53300 > 192.168.1.1.80: Flags [.], cksum 0x83e0 (incorrect -> 0xefe4), seq 1, ack 4644, win 342, options [nop,nop,TS val 1564082678 ecr 50019], length 0
11:30:17.272619 IP (tos 0x0, ttl 64, id 36183, offset 0, flags [DF], proto TCP (6), length 188)
    192.168.1.1.80 > 192.168.1.104.53300: Flags [.], cksum 0xea44 (correct), seq 4644:4780, ack 1, win 543, options [nop,nop,TS val 50019 ecr 1564082669], length 136: HTTP
11:30:17.272623 IP (tos 0x0, ttl 64, id 52269, offset 0, flags [DF], proto TCP (6), length 52)
    192.168.1.104.53300 > 192.168.1.1.80: Flags [.], cksum 0x83e0 (incorrect -> 0xef46), seq 1, ack 4780, win 364, options [nop,nop,TS val 1564082678 ecr 50019], length 0
11:30:17.272625 IP (tos 0x0, ttl 64, id 36184, offset 0, flags [DF], proto TCP (6), length 1178)
    192.168.1.1.80 > 192.168.1.104.53300: Flags [.], cksum 0x7c66 (correct), seq 4780:5906, ack 1, win 543, options [nop,nop,TS val 50019 ecr 1564082669], length 1126: HTTP
11:30:17.272630 IP (tos 0x0, ttl 64, id 52270, offset 0, flags [DF], proto TCP (6), length 52)
    192.168.1.104.53300 > 192.168.1.1.80: Flags [.], cksum 0x83e0 (incorrect -> 0xeac9), seq 1, ack 5906, win 387, options [nop,nop,TS val 1564082678 ecr 50019], length 0
11:30:17.273501 IP (tos 0x0, ttl 64, id 36184, offset 0, flags [DF], proto TCP (6), length 423)
    192.168.1.1.80 > 192.168.1.104.53300: Flags [P.], cksum 0x676f (correct), seq 5906:6277, ack 1, win 543, options [nop,nop,TS val 50020 ecr 1564082678], length 371: HTTP
11:30:17.273524 IP (tos 0x0, ttl 64, id 52271, offset 0, flags [DF], proto TCP (6), length 52)
    192.168.1.104.53300 > 192.168.1.1.80: Flags [.], cksum 0x83e0 (incorrect -> 0xe93d), seq 1, ack 6277, win 410, options [nop,nop,TS val 1564082679 ecr 50020], length 0
11:30:17.274371 IP (tos 0x0, ttl 64, id 11049, offset 0, flags [DF], proto TCP (6), length 52)
    192.168.1.1.80 > 192.168.1.104.53302: Flags [F.], cksum 0xc8f9 (correct), seq 1, ack 1, win 453, options [nop,nop,TS val 50021 ecr 1564082672], length 0
11:30:17.274400 IP (tos 0x0, ttl 64, id 0, offset 0, flags [DF], proto TCP (6), length 52)
    192.168.1.104.53302 > 192.168.1.1.80: Flags [.], cksum 0xc9d1 (correct), seq 1, ack 2, win 229, options [nop,nop,TS val 1564082680 ecr 50021], length 0
11:30:17.561363 ARP, Ethernet (len 6), IPv4 (len 4), Request who-has 192.168.1.80 tell 192.168.1.1, length 46
11:30:17.886328 IP (tos 0x0, ttl 64, id 52157, offset 0, flags [DF], proto TCP (6), length 1636)
    192.168.1.1.80 > 192.168.1.104.53304: Flags [.], cksum 0x8a10 (incorrect -> 0xa589), seq 1:1585, ack 407, win 543, options [nop,nop,TS val 50633 ecr 1564082673], length 1584: HTTP, length: 1584
	HTTP/1.1 200 OK
	Server: nginx
	Date: Mon, 13 Jan 2020 10:29:01 GMT
	Content-Type: text/css
	Content-Length: 179823
	Last-Modified: Tue, 16 Oct 2018 19:08:29 GMT
	Connection: keep-alive
	ETag: "5bc6372d-2be6f"
	X-Frame-Options: SAMEORIGIN
	Content-Security-Policy: default-src 'self';script-src 'self' 'unsafe-eval' 'unsafe-inline';style-src 'self' 'unsafe-inline'
	Accept-Ranges: bytes
	
	article,aside,details,figcaption,figure,footer,header,hgroup,nav,section{display:block;}
	audio,canvas,video{display:inline-block;*display:inline;*zoom:1;}
	audio:not([controls]){display:none;}
	html{font-size:100%;-webkit-text-size-adjust:100%;-ms-text-size-adjust:100%;}
	a:focus{outline:thin dotted #333;outline:5px auto -webkit-focus-ring-color;outline-offset:-2px;}
	a:hover,a:active{outline:0;}
	sub,sup{position:relative;font-size:75%;line-height:0;vertical-align:baseline;}
	sup{top:-0.5em;}
	sub{bottom:-0.25em;}
	img{max-width:100%;width:auto\9;height:auto;vertical-align:middle;border:0;-ms-interpolation-mode:bicubic;}
	#map_canvas img,.google-maps img{max-width:none;}
	button,input,select,textarea{margin:0;font-size:100%;vertical-align:middle;}
	button,input{*overflow:visible;line-height:normal;}
	button::-moz-focus-inner,input::-moz-focus-inner{padding:0;border:0;}
	button,html input[type="button"],input[type="reset"],input[type="submit"]{-webkit-appearance:button;cursor:pointer;}
	label,select,button,input[type="button"],input[type="reset"],input[type="submit"],input[type="radio"],input[type="checkbox"]{cursor:pointer;}
	input[type="search"]{-webkit-box-sizing:content-box;-moz-box-siz[!http]
11:30:17.886390 IP (tos 0x0, ttl 64, id 47767, offset 0, flags [DF], proto TCP (6), length 52)
    192.168.1.104.53304 > 192.168.1.1.80: Flags [.], cksum 0x83e0 (incorrect -> 0x3dec), seq 407, ack 1585, win 253, options [nop,nop,TS val 1564083292 ecr 50633], length 0
11:30:17.886403 IP (tos 0x0, ttl 64, id 52159, offset 0, flags [DF], proto TCP (6), length 4148)
    192.168.1.1.80 > 192.168.1.104.53304: Flags [.], cksum 0x93e0 (incorrect -> 0x9ccb), seq 1585:5681, ack 407, win 543, options [nop,nop,TS val 50633 ecr 1564082673], length 4096: HTTP
11:30:17.886411 IP (tos 0x0, ttl 64, id 47768, offset 0, flags [DF], proto TCP (6), length 52)
    192.168.1.104.53304 > 192.168.1.1.80: Flags [.], cksum 0x83e0 (incorrect -> 0x2dac), seq 407, ack 5681, win 317, options [nop,nop,TS val 1564083292 ecr 50633], length 0
11:30:17.886419 IP (tos 0x0, ttl 64, id 52162, offset 0, flags [DF], proto TCP (6), length 4148)
    192.168.1.1.80 > 192.168.1.104.53304: Flags [.], cksum 0x93e0 (incorrect -> 0xbd61), seq 5681:9777, ack 407, win 543, options [nop,nop,TS val 50633 ecr 1564082673], length 4096: HTTP
11:30:17.886423 IP (tos 0x0, ttl 64, id 47769, offset 0, flags [DF], proto TCP (6), length 52)
    192.168.1.104.53304 > 192.168.1.1.80: Flags [.], cksum 0x83e0 (incorrect -> 0x1d6c), seq 407, ack 9777, win 381, options [nop,nop,TS val 1564083292 ecr 50633], length 0
11:30:17.886430 IP (tos 0x0, ttl 64, id 52165, offset 0, flags [DF], proto TCP (6), length 4148)
    192.168.1.1.80 > 192.168.1.104.53304: Flags [.], cksum 0x93e0 (incorrect -> 0x49a6), seq 9777:13873, ack 407, win 543, options [nop,nop,TS val 50633 ecr 1564082673], length 4096: HTTP
11:30:17.886435 IP (tos 0x0, ttl 64, id 47770, offset 0, flags [DF], proto TCP (6), length 52)
    192.168.1.104.53304 > 192.168.1.1.80: Flags [.], cksum 0x83e0 (incorrect -> 0x0d2c), seq 407, ack 13873, win 445, options [nop,nop,TS val 1564083292 ecr 50633], length 0
11:30:17.886443 IP (tos 0x0, ttl 64, id 52168, offset 0, flags [DF], proto TCP (6), length 660)
    192.168.1.1.80 > 192.168.1.104.53304: Flags [.], cksum 0x0e41 (correct), seq 13873:14481, ack 407, win 543, options [nop,nop,TS val 50633 ecr 1564082673], length 608: HTTP
11:30:17.886449 IP (tos 0x0, ttl 64, id 47771, offset 0, flags [DF], proto TCP (6), length 52)
    192.168.1.104.53304 > 192.168.1.1.80: Flags [.], cksum 0x83e0 (incorrect -> 0x0ab5), seq 407, ack 14481, win 468, options [nop,nop,TS val 1564083292 ecr 50633], length 0
11:30:17.887612 IP (tos 0x0, ttl 64, id 52167, offset 0, flags [DF], proto TCP (6), length 1636)
    192.168.1.1.80 > 192.168.1.104.53304: Flags [.], cksum 0x8a10 (incorrect -> 0x9cf9), seq 14481:16065, ack 407, win 543, options [nop,nop,TS val 50634 ecr 1564083292], length 1584: HTTP
11:30:17.887631 IP (tos 0x0, ttl 64, id 47772, offset 0, flags [DF], proto TCP (6), length 52)
    192.168.1.104.53304 > 192.168.1.1.80: Flags [.], cksum 0x83e0 (incorrect -> 0x046a), seq 407, ack 16065, win 493, options [nop,nop,TS val 1564083293 ecr 50634], length 0
11:30:17.887642 IP (tos 0x0, ttl 64, id 52169, offset 0, flags [DF], proto TCP (6), length 3540)
    192.168.1.1.80 > 192.168.1.104.53304: Flags [.], cksum 0x9180 (incorrect -> 0xa79f), seq 16065:19553, ack 407, win 543, options [nop,nop,TS val 50634 ecr 1564083292], length 3488: HTTP
11:30:17.887647 IP (tos 0x0, ttl 64, id 47773, offset 0, flags [DF], proto TCP (6), length 52)
    192.168.1.104.53304 > 192.168.1.1.80: Flags [.], cksum 0x83e0 (incorrect -> 0xf693), seq 407, ack 19553, win 547, options [nop,nop,TS val 1564083293 ecr 50634], length 0
11:30:17.887652 IP (tos 0x0, ttl 64, id 52172, offset 0, flags [DF], proto TCP (6), length 2220)
    192.168.1.1.80 > 192.168.1.104.53304: Flags [.], cksum 0x8c58 (incorrect -> 0x07f1), seq 19553:21721, ack 407, win 543, options [nop,nop,TS val 50634 ecr 1564083292], length 2168: HTTP
11:30:17.887657 IP (tos 0x0, ttl 64, id 47774, offset 0, flags [DF], proto TCP (6), length 52)
    192.168.1.104.53304 > 192.168.1.1.80: Flags [.], cksum 0x83e0 (incorrect -> 0xedf9), seq 407, ack 21721, win 581, options [nop,nop,TS val 1564083293 ecr 50634], length 0
11:30:17.888194 IP (tos 0x0, ttl 64, id 52172, offset 0, flags [DF], proto TCP (6), length 1980)
    192.168.1.1.80 > 192.168.1.104.53304: Flags [.], cksum 0x8b68 (incorrect -> 0x4ab9), seq 21721:23649, ack 407, win 543, options [nop,nop,TS val 50635 ecr 1564083292], length 1928: HTTP
11:30:17.888210 IP (tos 0x0, ttl 64, id 47775, offset 0, flags [DF], proto TCP (6), length 52)
    192.168.1.104.53304 > 192.168.1.1.80: Flags [.], cksum 0x83e0 (incorrect -> 0xe651), seq 407, ack 23649, win 611, options [nop,nop,TS val 1564083294 ecr 50635], length 0
11:30:17.888219 IP (tos 0x0, ttl 64, id 52174, offset 0, flags [DF], proto TCP (6), length 4148)
    192.168.1.1.80 > 192.168.1.104.53304: Flags [.], cksum 0x93e0 (incorrect -> 0x8d56), seq 23649:27745, ack 407, win 543, options [nop,nop,TS val 50635 ecr 1564083292], length 4096: HTTP
11:30:17.888226 IP (tos 0x0, ttl 64, id 52177, offset 0, flags [DF], proto TCP (6), length 1268)
    192.168.1.1.80 > 192.168.1.104.53304: Flags [.], cksum 0x906c (correct), seq 27745:28961, ack 407, win 543, options [nop,nop,TS val 50635 ecr 1564083292], length 1216: HTTP
11:30:17.888232 IP (tos 0x0, ttl 64, id 47776, offset 0, flags [DF], proto TCP (6), length 52)
    192.168.1.104.53304 > 192.168.1.1.80: Flags [.], cksum 0x83e0 (incorrect -> 0xd611), seq 407, ack 27745, win 675, options [nop,nop,TS val 1564083294 ecr 50635], length 0
11:30:17.888238 IP (tos 0x0, ttl 64, id 47777, offset 0, flags [DF], proto TCP (6), length 52)
    192.168.1.104.53304 > 192.168.1.1.80: Flags [.], cksum 0x83e0 (incorrect -> 0xd13a), seq 407, ack 28961, win 698, options [nop,nop,TS val 1564083294 ecr 50635], length 0
11:30:17.914747 IP (tos 0x0, ttl 64, id 57990, offset 0, flags [DF], proto TCP (6), length 1636)
    192.168.1.1.80 > 192.168.1.104.53306: Flags [.], cksum 0x8a10 (incorrect -> 0xed21), seq 1:1585, ack 415, win 543, options [nop,nop,TS val 50661 ecr 1564082673], length 1584: HTTP, length: 1584
	HTTP/1.1 200 OK
	Server: nginx
	Date: Mon, 13 Jan 2020 10:29:02 GMT
	Content-Type: text/css
	Content-Length: 19588
	Last-Modified: Tue, 16 Oct 2018 19:08:29 GMT
	Connection: keep-alive
	ETag: "5bc6372d-4c84"
	X-Frame-Options: SAMEORIGIN
	Content-Security-Policy: default-src 'self';script-src 'self' 'unsafe-eval' 'unsafe-inline';style-src 'self' 'unsafe-inline'
	Accept-Ranges: bytes
	
	.clearfix{*zoom:1;}.clearfix:before,.clearfix:after{display:table;content:"";line-height:0;}
	.clearfix:after{clear:both;}
	.hide-text{font:0/0 a;color:transparent;text-shadow:none;background-color:transparent;border:0;}
	.input-block-level{display:block;width:100%;min-height:30px;-webkit-box-sizing:border-box;-moz-box-sizing:border-box;box-sizing:border-box;}
	@-ms-viewport{width:device-width;}.hidden{display:none;visibility:hidden;}
	.visible-phone{display:none !important;}
	.visible-tablet{display:none !important;}
	.hidden-desktop{display:none !important;}
	.visible-desktop{display:inherit !important;}
	@media screen and (min-width:768px) and (max-width:979px){.hidden-desktop{display:inherit !important;} .visible-desktop{display:none !important ;} .visible-tablet{display:inherit !important;} .hidden-tablet{display:none !important;}}@media screen and (max-width:767px){.popUp{z-index:2500;position:absolute;color:#333;top:35%;left:3%;width:93% !important;} .hidden-desktop{display:inherit !important;} .visible-desktop{display:none !important;} .visible-phone{display:inherit !important;} .hidden-phone{display:none !important;}}.visible-print{display:none !important;}
	@media print{.visibl[!http]
11:30:17.914773 IP (tos 0x0, ttl 64, id 14447, offset 0, flags [DF], proto TCP (6), length 52)
    192.168.1.104.53306 > 192.168.1.1.80: Flags [.], cksum 0x83e0 (incorrect -> 0x588e), seq 415, ack 1585, win 253, options [nop,nop,TS val 1564083320 ecr 50661], length 0
11:30:17.914780 IP (tos 0x0, ttl 64, id 57992, offset 0, flags [DF], proto TCP (6), length 4148)
    192.168.1.1.80 > 192.168.1.104.53306: Flags [.], cksum 0x93e0 (incorrect -> 0x76c3), seq 1585:5681, ack 415, win 543, options [nop,nop,TS val 50661 ecr 1564082673], length 4096: HTTP
11:30:17.914785 IP (tos 0x0, ttl 64, id 14448, offset 0, flags [DF], proto TCP (6), length 52)
    192.168.1.104.53306 > 192.168.1.1.80: Flags [.], cksum 0x83e0 (incorrect -> 0x484e), seq 415, ack 5681, win 317, options [nop,nop,TS val 1564083320 ecr 50661], length 0
11:30:17.914789 IP (tos 0x0, ttl 64, id 57995, offset 0, flags [DF], proto TCP (6), length 4148)
    192.168.1.1.80 > 192.168.1.104.53306: Flags [.], cksum 0x93e0 (incorrect -> 0xb87f), seq 5681:9777, ack 415, win 543, options [nop,nop,TS val 50661 ecr 1564082673], length 4096: HTTP
11:30:17.914793 IP (tos 0x0, ttl 64, id 14449, offset 0, flags [DF], proto TCP (6), length 52)
    192.168.1.104.53306 > 192.168.1.1.80: Flags [.], cksum 0x83e0 (incorrect -> 0x380e), seq 415, ack 9777, win 381, options [nop,nop,TS val 1564083320 ecr 50661], length 0
11:30:17.914797 IP (tos 0x0, ttl 64, id 57998, offset 0, flags [DF], proto TCP (6), length 4148)
    192.168.1.1.80 > 192.168.1.104.53306: Flags [.], cksum 0x93e0 (incorrect -> 0xc5ff), seq 9777:13873, ack 415, win 543, options [nop,nop,TS val 50661 ecr 1564082673], length 4096: HTTP
11:30:17.914801 IP (tos 0x0, ttl 64, id 14450, offset 0, flags [DF], proto TCP (6), length 52)
    192.168.1.104.53306 > 192.168.1.1.80: Flags [.], cksum 0x83e0 (incorrect -> 0x27ce), seq 415, ack 13873, win 445, options [nop,nop,TS val 1564083320 ecr 50661], length 0
11:30:17.914808 IP (tos 0x0, ttl 64, id 58001, offset 0, flags [DF], proto TCP (6), length 660)
    192.168.1.1.80 > 192.168.1.104.53306: Flags [.], cksum 0x363e (correct), seq 13873:14481, ack 415, win 543, options [nop,nop,TS val 50661 ecr 1564082673], length 608: HTTP
11:30:17.914812 IP (tos 0x0, ttl 64, id 14451, offset 0, flags [DF], proto TCP (6), length 52)
    192.168.1.104.53306 > 192.168.1.1.80: Flags [.], cksum 0x83e0 (incorrect -> 0x2557), seq 415, ack 14481, win 468, options [nop,nop,TS val 1564083320 ecr 50661], length 0
11:30:17.916041 IP (tos 0x0, ttl 64, id 58000, offset 0, flags [DF], proto TCP (6), length 1636)
    192.168.1.1.80 > 192.168.1.104.53306: Flags [.], cksum 0x8a10 (incorrect -> 0xaac8), seq 14481:16065, ack 415, win 543, options [nop,nop,TS val 50662 ecr 1564083320], length 1584: HTTP
11:30:17.916058 IP (tos 0x0, ttl 64, id 14452, offset 0, flags [DF], proto TCP (6), length 52)
    192.168.1.104.53306 > 192.168.1.1.80: Flags [.], cksum 0x83e0 (incorrect -> 0x1f0b), seq 415, ack 16065, win 493, options [nop,nop,TS val 1564083322 ecr 50662], length 0
11:30:17.916063 IP (tos 0x0, ttl 64, id 58002, offset 0, flags [DF], proto TCP (6), length 2812)
    192.168.1.1.80 > 192.168.1.104.53306: Flags [.], cksum 0x8ea8 (incorrect -> 0xbc4d), seq 16065:18825, ack 415, win 543, options [nop,nop,TS val 50662 ecr 1564083320], length 2760: HTTP
11:30:17.916067 IP (tos 0x0, ttl 64, id 14453, offset 0, flags [DF], proto TCP (6), length 52)
    192.168.1.104.53306 > 192.168.1.1.80: Flags [.], cksum 0x83e0 (incorrect -> 0x1418), seq 415, ack 18825, win 536, options [nop,nop,TS val 1564083322 ecr 50662], length 0
11:30:17.916070 IP (tos 0x0, ttl 64, id 58003, offset 0, flags [DF], proto TCP (6), length 1204)
    192.168.1.1.80 > 192.168.1.104.53306: Flags [.], cksum 0x8860 (incorrect -> 0x84ba), seq 18825:19977, ack 415, win 543, options [nop,nop,TS val 50663 ecr 1564083320], length 1152: HTTP
11:30:17.916074 IP (tos 0x0, ttl 64, id 14454, offset 0, flags [DF], proto TCP (6), length 52)
    192.168.1.104.53306 > 192.168.1.1.80: Flags [.], cksum 0x83e0 (incorrect -> 0x0f81), seq 415, ack 19977, win 558, options [nop,nop,TS val 1564083322 ecr 50663], length 0
11:30:17.917234 IP (tos 0x0, ttl 64, id 14455, offset 0, flags [DF], proto TCP (6), length 447)
    192.168.1.104.53306 > 192.168.1.1.80: Flags [P.], cksum 0x856b (incorrect -> 0x83e8), seq 415:810, ack 19977, win 558, options [nop,nop,TS val 1564083323 ecr 50663], length 395: HTTP, length: 395
	GET /js/main-min.js HTTP/1.1
	Host: 192.168.1.1
	Connection: keep-alive
	User-Agent: Mozilla/5.0 (X11; Linux x86_64) AppleWebKit/537.36 (KHTML, like Gecko) Chrome/78.0.3904.108 Safari/537.36
	Accept: */*
	Referer: http://192.168.1.1/
	Accept-Encoding: gzip, deflate
	Accept-Language: en-US,en;q=0.9,sv;q=0.8
	Cookie: sessionID=253c8476d6fd6812f4a269235504b895fe4a93a2bd39ceebd6f37ab224f37b69
	
11:30:17.917834 IP (tos 0x0, ttl 64, id 58004, offset 0, flags [DF], proto TCP (6), length 52)
    192.168.1.1.80 > 192.168.1.104.53306: Flags [.], cksum 0x0da8 (correct), seq 19977, ack 810, win 634, options [nop,nop,TS val 50664 ecr 1564083323], length 0
11:30:17.930106 IP (tos 0x0, ttl 64, id 52177, offset 0, flags [DF], proto TCP (6), length 1636)
    192.168.1.1.80 > 192.168.1.104.53304: Flags [.], cksum 0x8a10 (incorrect -> 0xe932), seq 28961:30545, ack 407, win 543, options [nop,nop,TS val 50662 ecr 1564083294], length 1584: HTTP
11:30:17.930161 IP (tos 0x0, ttl 64, id 47778, offset 0, flags [DF], proto TCP (6), length 52)
    192.168.1.104.53304 > 192.168.1.1.80: Flags [.], cksum 0x83e0 (incorrect -> 0xcaac), seq 407, ack 30545, win 723, options [nop,nop,TS val 1564083336 ecr 50662], length 0
11:30:17.930175 IP (tos 0x0, ttl 64, id 52179, offset 0, flags [DF], proto TCP (6), length 2932)
    192.168.1.1.80 > 192.168.1.104.53304: Flags [.], cksum 0x8f20 (incorrect -> 0x9313), seq 30545:33425, ack 407, win 543, options [nop,nop,TS val 50662 ecr 1564083294], length 2880: HTTP
11:30:17.930181 IP (tos 0x0, ttl 64, id 47779, offset 0, flags [DF], proto TCP (6), length 52)
    192.168.1.104.53304 > 192.168.1.1.80: Flags [.], cksum 0x83e0 (incorrect -> 0xbf3f), seq 407, ack 33425, win 768, options [nop,nop,TS val 1564083336 ecr 50662], length 0
11:30:17.930191 IP (tos 0x0, ttl 64, id 52181, offset 0, flags [DF], proto TCP (6), length 4148)
    192.168.1.1.80 > 192.168.1.104.53304: Flags [.], cksum 0x93e0 (incorrect -> 0x8282), seq 33425:37521, ack 407, win 543, options [nop,nop,TS val 50662 ecr 1564083294], length 4096: HTTP
11:30:17.930197 IP (tos 0x0, ttl 64, id 47780, offset 0, flags [DF], proto TCP (6), length 52)
    192.168.1.104.53304 > 192.168.1.1.80: Flags [.], cksum 0x83e0 (incorrect -> 0xaeff), seq 407, ack 37521, win 832, options [nop,nop,TS val 1564083336 ecr 50662], length 0
11:30:17.930205 IP (tos 0x0, ttl 64, id 52184, offset 0, flags [DF], proto TCP (6), length 4148)
    192.168.1.1.80 > 192.168.1.104.53304: Flags [.], cksum 0x93e0 (incorrect -> 0x3c41), seq 37521:41617, ack 407, win 543, options [nop,nop,TS val 50662 ecr 1564083294], length 4096: HTTP
11:30:17.930210 IP (tos 0x0, ttl 64, id 47781, offset 0, flags [DF], proto TCP (6), length 52)
    192.168.1.104.53304 > 192.168.1.1.80: Flags [.], cksum 0x83e0 (incorrect -> 0x9ebf), seq 407, ack 41617, win 896, options [nop,nop,TS val 1564083336 ecr 50662], length 0
11:30:17.930219 IP (tos 0x0, ttl 64, id 52187, offset 0, flags [DF], proto TCP (6), length 4148)
    192.168.1.1.80 > 192.168.1.104.53304: Flags [.], cksum 0x93e0 (incorrect -> 0x6527), seq 41617:45713, ack 407, win 543, options [nop,nop,TS val 50662 ecr 1564083294], length 4096: HTTP
11:30:17.930228 IP (tos 0x0, ttl 64, id 52190, offset 0, flags [DF], proto TCP (6), length 4148)
    192.168.1.1.80 > 192.168.1.104.53304: Flags [.], cksum 0x93e0 (incorrect -> 0x4c87), seq 45713:49809, ack 407, win 543, options [nop,nop,TS val 50662 ecr 1564083294], length 4096: HTTP
11:30:17.930246 IP (tos 0x0, ttl 64, id 52193, offset 0, flags [DF], proto TCP (6), length 924)
    192.168.1.1.80 > 192.168.1.104.53304: Flags [.], cksum 0xdb28 (correct), seq 49809:50681, ack 407, win 543, options [nop,nop,TS val 50662 ecr 1564083294], length 872: HTTP
11:30:17.930260 IP (tos 0x0, ttl 64, id 47782, offset 0, flags [DF], proto TCP (6), length 52)
    192.168.1.104.53304 > 192.168.1.1.80: Flags [.], cksum 0x83e0 (incorrect -> 0x8e7f), seq 407, ack 45713, win 960, options [nop,nop,TS val 1564083336 ecr 50662], length 0
11:30:17.930266 IP (tos 0x0, ttl 64, id 47783, offset 0, flags [DF], proto TCP (6), length 52)
    192.168.1.104.53304 > 192.168.1.1.80: Flags [.], cksum 0x83e0 (incorrect -> 0x7e3f), seq 407, ack 49809, win 1024, options [nop,nop,TS val 1564083336 ecr 50662], length 0
11:30:17.930270 IP (tos 0x0, ttl 64, id 47784, offset 0, flags [DF], proto TCP (6), length 52)
    192.168.1.104.53304 > 192.168.1.1.80: Flags [.], cksum 0x83e0 (incorrect -> 0x7ac1), seq 407, ack 50681, win 1046, options [nop,nop,TS val 1564083336 ecr 50662], length 0
11:30:17.931586 IP (tos 0x0, ttl 64, id 52192, offset 0, flags [DF], proto TCP (6), length 3276)
    192.168.1.1.80 > 192.168.1.104.53304: Flags [.], cksum 0x9078 (incorrect -> 0x6fbe), seq 50681:53905, ack 407, win 543, options [nop,nop,TS val 50678 ecr 1564083336], length 3224: HTTP
11:30:17.931607 IP (tos 0x0, ttl 64, id 47785, offset 0, flags [DF], proto TCP (6), length 52)
    192.168.1.104.53304 > 192.168.1.1.80: Flags [.], cksum 0x83e0 (incorrect -> 0x6de5), seq 407, ack 53905, win 1097, options [nop,nop,TS val 1564083337 ecr 50678], length 0
11:30:17.931618 IP (tos 0x0, ttl 64, id 52195, offset 0, flags [DF], proto TCP (6), length 4148)
    192.168.1.1.80 > 192.168.1.104.53304: Flags [.], cksum 0x93e0 (incorrect -> 0x7b8e), seq 53905:58001, ack 407, win 543, options [nop,nop,TS val 50678 ecr 1564083336], length 4096: HTTP
11:30:17.931622 IP (tos 0x0, ttl 64, id 47786, offset 0, flags [DF], proto TCP (6), length 52)
    192.168.1.104.53304 > 192.168.1.1.80: Flags [.], cksum 0x83e0 (incorrect -> 0x5da5), seq 407, ack 58001, win 1161, options [nop,nop,TS val 1564083337 ecr 50678], length 0
11:30:17.931627 IP (tos 0x0, ttl 64, id 52198, offset 0, flags [DF], proto TCP (6), length 2868)
    192.168.1.1.80 > 192.168.1.104.53304: Flags [.], cksum 0x8ee0 (incorrect -> 0x18be), seq 58001:60817, ack 407, win 543, options [nop,nop,TS val 50678 ecr 1564083336], length 2816: HTTP
11:30:17.931642 IP (tos 0x0, ttl 64, id 47787, offset 0, flags [DF], proto TCP (6), length 52)
    192.168.1.104.53304 > 192.168.1.1.80: Flags [.], cksum 0x83e0 (incorrect -> 0x5279), seq 407, ack 60817, win 1205, options [nop,nop,TS val 1564083337 ecr 50678], length 0
11:30:17.932766 IP (tos 0x0, ttl 64, id 52199, offset 0, flags [DF], proto TCP (6), length 1332)
    192.168.1.1.80 > 192.168.1.104.53304: Flags [.], cksum 0x3507 (correct), seq 60817:62097, ack 407, win 543, options [nop,nop,TS val 50679 ecr 1564083336], length 1280: HTTP
11:30:17.932788 IP (tos 0x0, ttl 64, id 47788, offset 0, flags [DF], proto TCP (6), length 52)
    192.168.1.104.53304 > 192.168.1.1.80: Flags [.], cksum 0x83e0 (incorrect -> 0x4d61), seq 407, ack 62097, win 1227, options [nop,nop,TS val 1564083338 ecr 50679], length 0
11:30:17.932795 IP (tos 0x0, ttl 64, id 52200, offset 0, flags [DF], proto TCP (6), length 4148)
    192.168.1.1.80 > 192.168.1.104.53304: Flags [.], cksum 0x93e0 (incorrect -> 0xd8a9), seq 62097:66193, ack 407, win 543, options [nop,nop,TS val 50679 ecr 1564083336], length 4096: HTTP
11:30:17.932799 IP (tos 0x0, ttl 64, id 47789, offset 0, flags [DF], proto TCP (6), length 52)
    192.168.1.104.53304 > 192.168.1.1.80: Flags [.], cksum 0x83e0 (incorrect -> 0x3d21), seq 407, ack 66193, win 1291, options [nop,nop,TS val 1564083338 ecr 50679], length 0
11:30:17.932805 IP (tos 0x0, ttl 64, id 52203, offset 0, flags [DF], proto TCP (6), length 3364)
    192.168.1.1.80 > 192.168.1.104.53304: Flags [.], cksum 0x90d0 (incorrect -> 0xf45b), seq 66193:69505, ack 407, win 543, options [nop,nop,TS val 50679 ecr 1564083336], length 3312: HTTP
11:30:17.932821 IP (tos 0x0, ttl 64, id 47790, offset 0, flags [DF], proto TCP (6), length 52)
    192.168.1.104.53304 > 192.168.1.1.80: Flags [.], cksum 0x83e0 (incorrect -> 0x2ffd), seq 407, ack 69505, win 1343, options [nop,nop,TS val 1564083338 ecr 50679], length 0
11:30:17.933346 IP (tos 0x0, ttl 64, id 52205, offset 0, flags [DF], proto TCP (6), length 836)
    192.168.1.1.80 > 192.168.1.104.53304: Flags [.], cksum 0xe148 (correct), seq 69505:70289, ack 407, win 543, options [nop,nop,TS val 50680 ecr 1564083337], length 784: HTTP
11:30:17.933354 IP (tos 0x0, ttl 64, id 47791, offset 0, flags [DF], proto TCP (6), length 52)
    192.168.1.104.53304 > 192.168.1.1.80: Flags [.], cksum 0x83e0 (incorrect -> 0x2cd4), seq 407, ack 70289, win 1366, options [nop,nop,TS val 1564083339 ecr 50680], length 0
11:30:17.933360 IP (tos 0x0, ttl 64, id 52206, offset 0, flags [DF], proto TCP (6), length 4148)
    192.168.1.1.80 > 192.168.1.104.53304: Flags [.], cksum 0x93e0 (incorrect -> 0x63c0), seq 70289:74385, ack 407, win 543, options [nop,nop,TS val 50680 ecr 1564083337], length 4096: HTTP
11:30:17.933364 IP (tos 0x0, ttl 64, id 52209, offset 0, flags [DF], proto TCP (6), length 3860)
    192.168.1.1.80 > 192.168.1.104.53304: Flags [.], cksum 0x92c0 (incorrect -> 0x1736), seq 74385:78193, ack 407, win 543, options [nop,nop,TS val 50680 ecr 1564083337], length 3808: HTTP
11:30:17.933370 IP (tos 0x0, ttl 64, id 47792, offset 0, flags [DF], proto TCP (6), length 52)
    192.168.1.104.53304 > 192.168.1.1.80: Flags [.], cksum 0x83e0 (incorrect -> 0x1ca6), seq 407, ack 74385, win 1412, options [nop,nop,TS val 1564083339 ecr 50680], length 0
11:30:17.933374 IP (tos 0x0, ttl 64, id 47793, offset 0, flags [DF], proto TCP (6), length 52)
    192.168.1.104.53304 > 192.168.1.1.80: Flags [.], cksum 0x83e0 (incorrect -> 0x0ddd), seq 407, ack 78193, win 1389, options [nop,nop,TS val 1564083339 ecr 50680], length 0
11:30:17.933967 IP (tos 0x0, ttl 64, id 52211, offset 0, flags [DF], proto TCP (6), length 340)
    192.168.1.1.80 > 192.168.1.104.53304: Flags [.], cksum 0xbbf0 (correct), seq 78193:78481, ack 407, win 543, options [nop,nop,TS val 50680 ecr 1564083338], length 288: HTTP
11:30:17.933978 IP (tos 0x0, ttl 64, id 47794, offset 0, flags [DF], proto TCP (6), length 52)
    192.168.1.104.53304 > 192.168.1.1.80: Flags [.], cksum 0x83e0 (incorrect -> 0x0c99), seq 407, ack 78481, win 1424, options [nop,nop,TS val 1564083340 ecr 50680], length 0
11:30:17.933986 IP (tos 0x0, ttl 64, id 52212, offset 0, flags [DF], proto TCP (6), length 4148)
    192.168.1.1.80 > 192.168.1.104.53304: Flags [.], cksum 0x93e0 (incorrect -> 0xc1ae), seq 78481:82577, ack 407, win 543, options [nop,nop,TS val 50680 ecr 1564083338], length 4096: HTTP
11:30:17.933996 IP (tos 0x0, ttl 64, id 52215, offset 0, flags [DF], proto TCP (6), length 4148)
    192.168.1.1.80 > 192.168.1.104.53304: Flags [.], cksum 0x93e0 (incorrect -> 0x9a2a), seq 82577:86673, ack 407, win 543, options [nop,nop,TS val 50680 ecr 1564083338], length 4096: HTTP
11:30:17.933999 IP (tos 0x0, ttl 64, id 47795, offset 0, flags [DF], proto TCP (6), length 52)
    192.168.1.104.53304 > 192.168.1.1.80: Flags [.], cksum 0x83e0 (incorrect -> 0xfca4), seq 407, ack 82577, win 1412, options [nop,nop,TS val 1564083340 ecr 50680], length 0
11:30:17.934003 IP (tos 0x0, ttl 64, id 52218, offset 0, flags [DF], proto TCP (6), length 3156)
    192.168.1.1.80 > 192.168.1.104.53304: Flags [.], cksum 0x9000 (incorrect -> 0x10d2), seq 86673:89777, ack 407, win 543, options [nop,nop,TS val 50680 ecr 1564083338], length 3104: HTTP
11:30:17.934005 IP (tos 0x0, ttl 64, id 47796, offset 0, flags [DF], proto TCP (6), length 52)
    192.168.1.104.53304 > 192.168.1.1.80: Flags [.], cksum 0x83e0 (incorrect -> 0xecbb), seq 407, ack 86673, win 1389, options [nop,nop,TS val 1564083340 ecr 50680], length 0
11:30:17.934009 IP (tos 0x0, ttl 64, id 47797, offset 0, flags [DF], proto TCP (6), length 52)
    192.168.1.104.53304 > 192.168.1.1.80: Flags [.], cksum 0x83e0 (incorrect -> 0xe0b1), seq 407, ack 89777, win 1367, options [nop,nop,TS val 1564083340 ecr 50680], length 0
11:30:17.934786 IP (tos 0x0, ttl 64, id 52219, offset 0, flags [DF], proto TCP (6), length 1044)
    192.168.1.1.80 > 192.168.1.104.53304: Flags [.], cksum 0x7801 (correct), seq 89777:90769, ack 407, win 543, options [nop,nop,TS val 50681 ecr 1564083339], length 992: HTTP
11:30:17.934794 IP (tos 0x0, ttl 64, id 47798, offset 0, flags [DF], proto TCP (6), length 52)
    192.168.1.104.53304 > 192.168.1.1.80: Flags [.], cksum 0x83e0 (incorrect -> 0xdc97), seq 407, ack 90769, win 1424, options [nop,nop,TS val 1564083340 ecr 50681], length 0
